{
  "schema_version": 1,
  "module_id": "classifier",
  "purpose": "TensorFlow/Keras multilingual mDeBERTa classifier, classical baseline, checkpoint selection and regularized transfer-learning training",
  "paths": [
    {"path": "models/text_classifier.py", "lifecycle": "implemented", "provenance": "authored"},
    {"path": "models/baseline.py", "lifecycle": "implemented", "provenance": "authored"},
    {"path": "models/calibration.py", "lifecycle": "implemented", "provenance": "authored"},
    {"path": "utils/transfer_learning.py", "lifecycle": "implemented", "provenance": "authored"},
    {"path": "utils/model_optimization.py", "lifecycle": "implemented", "provenance": "authored"},
    {"path": "scripts/train.py", "lifecycle": "implemented", "provenance": "authored"},
    {"path": "scripts/train_revision2.py", "lifecycle": "implemented", "provenance": "authored"},
    {"path": "scripts/preflight_revision2.py", "lifecycle": "implemented", "provenance": "authored"},
    {"path": "scripts/smoke_classifier.py", "lifecycle": "implemented", "provenance": "authored"}
  ],
  "contracts": [],
  "validators": ["scripts/validate_agent_contracts.py"],
  "tests": [
    "tests/test_classifier_config.py",
    "tests/test_calibration.py",
    "tests/test_transfer_learning_selection.py"
  ],
  "runtime_evidence": [
    "reports/revision2/preflight.json",
    "reports/revision2/baseline_validation.json",
    "reports/revision2/training_history.csv",
    "reports/revision2/checkpoint_selection.json",
    "reports/revision2/performance_metrics.json"
  ]
}
